{
  "$schema": "https://json-schema.org/draft/2020-12/schema",
  "$id": "https://tymehall.org/schemas/work-promotion.v0.schema.json",
  "title": "Work Promotion Record v0",
  "type": "object",
  "additionalProperties": false,
  "required": ["promotion_id","review_disposition_ref","review_disposition_sha256","admission_ref","source_event_ref","promoted_at","promoter","governance","result"],
  "properties": {
    "promotion_id": {"type":"string","minLength":1},
    "review_disposition_ref": {"type":"string","minLength":1},
    "review_disposition_sha256": {"type":"string","pattern":"^[0-9a-f]{64}$"},
    "admission_ref": {"type":"string","minLength":1},
    "source_event_ref": {"type":"string","minLength":1},
    "promoted_at": {"type":"string","pattern":"^\\d{4}-\\d{2}-\\d{2}T\\d{2}:\\d{2}:[0-5]\\d(?:\\.\\d{1,6})?Z$"},
    "promoter": {
      "type":"object","additionalProperties":false,
      "required":["actor_id","actor_type","origin_surface","authenticated_transport","authority_envelope_ref","authority_envelope_sha256"],
      "properties": {
        "actor_id":{"type":"string","minLength":1,"maxLength":2048},
        "actor_type":{"enum":["human","agent","service"]},
        "origin_surface":{"type":"string","pattern":"^[a-z][a-z0-9_-]{0,63}$"},
        "authenticated_transport": {
          "type":"object","additionalProperties":false,
          "required":["type","github_actor"],
          "properties": {
            "type":{"const":"github-actions"},
            "github_actor":{"type":"string","minLength":1}
          }
        },
        "authority_envelope_ref":{"type":"string","minLength":1,"maxLength":2048},
        "authority_envelope_sha256":{"type":"string","pattern":"^[0-9a-f]{64}$"}
      }
    },
    "governance": {
      "type":"object","additionalProperties":false,
      "required":["authority_effect","required_scope","grant_policy_ref","grant_policy_sha256","matched_grant_sha256","source_mutation_allowed","participant_selected","execution_authority_granted"],
      "properties": {
        "authority_effect":{"const":"work_promotion_only"},
        "required_scope":{"const":"work-promotion"},
        "grant_policy_ref":{"const":"governance/authorized-work-promotion-scopes.v0.json"},
        "grant_policy_sha256":{"type":"string","pattern":"^[0-9a-f]{64}$"},
        "matched_grant_sha256":{"type":"string","pattern":"^[0-9a-f]{64}$"},
        "source_mutation_allowed":{"const":false},
        "participant_selected":{"const":false},
        "execution_authority_granted":{"const":false}
      }
    },
    "result": {
      "type":"object","additionalProperties":false,
      "required":["work_created","work_ref"],
      "properties": {
        "work_created":{"const":true},
        "work_ref":{"type":"string","minLength":1}
      }
    }
  }
}
